地点,薪资,职位,岗位需求
南昌,5.9K-11.8K,JAVA+AI软件工程师实习生,"人才基地承担着中关村软件园园区内500多家知名IT企业的人才培养、招聘的任务，本次招聘的岗位全部采用企业定制，所招实习生实习结束，统一安排在园区工作，千载难逢，机会难得......【招收岗位】：1、Java+大数据软件开发工程师签约实习生2、 人工智能+Python开发工程师签约实习生【任职要求】：1、大专及以上学历，计算机（网络)、电子信息、软件工程、（电气）自动化、测控、生仪、机电、数学或英语等专业。2、有计算机语言基础者优先，如：C语言、Java、.Net、PHP等；【福利待遇】：1、签订正式《劳动合同》、五险一金等。2、在京工作一年后要求回当地工作的，可申请调回当地省会城市的分公司或合作企业工作。【职业背景】1、Java+大数据——Java已经连续21年位居热门编程语言之首。在薪酬待遇方面，远高于其他程序员。Java+大数据开发工程师，待遇更高，入职轻松起薪12k.2、人工智能+ Python——人工智已经走进我们的生活，来得有些突然，以至于目前国内大学还没有开设人工智能专业，一名入门级的AI工程师月薪轻松就可以拿到15K，中、高级工程师，企业更是给出30万到150万的年薪；Python非常适合AI开发，它更接近自然语言，编程简单,速度超快，它能够把各种模块很轻松地联结在一起,开发人员不必重复造轮子，像搭积木一样就可以完成绝大部分工作， 非常适合初学编程者。　　　未来将是人工智能的天下，越来越多的工作都将被人工智能替代！如果你够睿智，就算是壮士断腕，也要毅然决然地走进“人工智能”，四年后，当第一期AI大学生进入这一领域时，你已经年薪百万，已经是他们的总监、是他们的CEO了。人工智能时代刚刚拉开帷幕，现在加入，你就是下一个技术时代的王者。详询电话（微信）：18910253892北京中关村软件园欢迎您！"
青岛,5.9K-11.8K,JAVA+AI软件工程师实习生,"人才基地承担着中关村软件园园区内500多家知名IT企业的人才培养、招聘的任务，本次招聘的岗位全部采用企业定制，所招实习生实习结束，统一安排在园区工作，千载难逢，机会难得......【招收岗位】：1、Java+大数据软件开发工程师签约实习生2、 人工智能+Python开发工程师签约实习生【任职要求】：1、大专及以上学历，计算机（网络)、电子信息、软件工程、（电气）自动化、测控、生仪、机电、数学或英语等专业。2、有计算机语言基础者优先，如：C语言、Java、.Net、PHP等；【福利待遇】：1、签订正式《劳动合同》、五险一金等。2、在京工作一年后要求回当地工作的，可申请调回当地省会城市的分公司或合作企业工作。【职业背景】1、Java+大数据——Java已经连续21年位居热门编程语言之首。在薪酬待遇方面，远高于其他程序员。Java+大数据开发工程师，待遇更高，入职轻松起薪12k.2、人工智能+ Python——人工智已经走进我们的生活，来得有些突然，以至于目前国内大学还没有开设人工智能专业，一名入门级的AI工程师月薪轻松就可以拿到15K，中、高级工程师，企业更是给出30万到150万的年薪；Python非常适合AI开发，它更接近自然语言，编程简单,速度超快，它能够把各种模块很轻松地联结在一起,开发人员不必重复造轮子，像搭积木一样就可以完成绝大部分工作， 非常适合初学编程者。　　　未来将是人工智能的天下，越来越多的工作都将被人工智能替代！如果你够睿智，就算是壮士断腕，也要毅然决然地走进“人工智能”，四年后，当第一期AI大学生进入这一领域时，你已经年薪百万，已经是他们的总监、是他们的CEO了。人工智能时代刚刚拉开帷幕，现在加入，你就是下一个技术时代的王者。详询电话（微信）：18910253892北京中关村软件园欢迎您！"
长沙,9K-13K,JAVA高级软件工程师,岗位职责：1、参与项目的需求分析，负责项目的架构设计、模块设计和开发；2、负责指导软件工程师详细设计和开发；3、负责解决项目中的技术难点（后端核心代码）和技术把关；4、负责系统性能优化，解决平台升级和优化过程中出现的问题。任职要求：1、26-40岁，计算机本科以上学历。2、5年及以上JAVA开发的经验，至少1个以上微信产品开发经验；精通Spring、SpringMVC、Mybatis和移动开发框架，有自己架构设计框架作品者优先。3、熟悉持续集成和部署，并有过敏捷开发经验者优先考虑。4、学习能力强，适应能力好；有良好的编码习惯，具备耐心、细心的品质。
西安,8K-12K,Java  高级开发工程师,"工作职责：1、 负责基础框架代码编写和核心代码编写。2、 优化系统架构设计，针对现有服务体提出改进意见。3、 和公司各业务团队沟通，推动功能顺利完成。4、项目概要设计、详细设计、开发计划等的编制并实施；5、参与线上系统疑难杂症问题攻关，能够指导初中级工程师，组织团队技术分享，促进团队成员共同进步.岗位要求：1、 五年以上java实际项目开发经验，java基础扎实，熟悉IO、多线程、集合等基础框架。2、 熟悉开源应用框架以及工具，如Spring、ibatis、XML、JSON、Maven,Git等开发技术。3、 熟练使用msyql，熟悉数据库原理和常用性能优化技术，以及NoSQL（redis、mongo）使用场景以及限制。4、 熟悉前后端一体化开发模式，熟悉页面样式css和vue等技术优先。5、 有开源框架学习并有心得者优先，Spring Boot、Spring Cloud开发经验优先。6、 具有一定的项目规划和决策能力，善于捕捉业务需求、架构设计中存在的问题，并给出有效的解决措施和方法。7、 能适应短期出差。"
兰州,5.9K-11.8K,JAVA+AI软件工程师实习生,"人才基地承担着中关村软件园园区内500多家知名IT企业的人才培养、招聘的任务，本次招聘的岗位全部采用企业定制，所招实习生实习结束，统一安排在园区工作，千载难逢，机会难得......【招收岗位】：1、Java+大数据软件开发工程师签约实习生2、 人工智能+Python开发工程师签约实习生【任职要求】：1、大专及以上学历，计算机（网络)、电子信息、软件工程、（电气）自动化、测控、生仪、机电、数学或英语等专业。2、有计算机语言基础者优先，如：C语言、Java、.Net、PHP等；【福利待遇】：1、签订正式《劳动合同》、五险一金等。2、在京工作一年后要求回当地工作的，可申请调回当地省会城市的分公司或合作企业工作。【职业背景】1、Java+大数据——Java已经连续21年位居热门编程语言之首。在薪酬待遇方面，远高于其他程序员。Java+大数据开发工程师，待遇更高，入职轻松起薪12k.2、人工智能+ Python——人工智已经走进我们的生活，来得有些突然，以至于目前国内大学还没有开设人工智能专业，一名入门级的AI工程师月薪轻松就可以拿到15K，中、高级工程师，企业更是给出30万到150万的年薪；Python非常适合AI开发，它更接近自然语言，编程简单,速度超快，它能够把各种模块很轻松地联结在一起,开发人员不必重复造轮子，像搭积木一样就可以完成绝大部分工作， 非常适合初学编程者。　　　未来将是人工智能的天下，越来越多的工作都将被人工智能替代！如果你够睿智，就算是壮士断腕，也要毅然决然地走进“人工智能”，四年后，当第一期AI大学生进入这一领域时，你已经年薪百万，已经是他们的总监、是他们的CEO了。人工智能时代刚刚拉开帷幕，现在加入，你就是下一个技术时代的王者。详询电话（微信）：18910253892北京中关村软件园欢迎您！"
长春,5.9K-11.8K,JAVA+AI软件工程师实习生,"人才基地承担着中关村软件园园区内500多家知名IT企业的人才培养、招聘的任务，本次招聘的岗位全部采用企业定制，所招实习生实习结束，统一安排在园区工作，千载难逢，机会难得......【招收岗位】：1、Java+大数据软件开发工程师签约实习生2、 人工智能+Python开发工程师签约实习生【任职要求】：1、大专及以上学历，计算机（网络)、电子信息、软件工程、（电气）自动化、测控、生仪、机电、数学或英语等专业。2、有计算机语言基础者优先，如：C语言、Java、.Net、PHP等；【福利待遇】：1、签订正式《劳动合同》、五险一金等。2、在京工作一年后要求回当地工作的，可申请调回当地省会城市的分公司或合作企业工作。【职业背景】1、Java+大数据——Java已经连续21年位居热门编程语言之首。在薪酬待遇方面，远高于其他程序员。Java+大数据开发工程师，待遇更高，入职轻松起薪12k.2、人工智能+ Python——人工智已经走进我们的生活，来得有些突然，以至于目前国内大学还没有开设人工智能专业，一名入门级的AI工程师月薪轻松就可以拿到15K，中、高级工程师，企业更是给出30万到150万的年薪；Python非常适合AI开发，它更接近自然语言，编程简单,速度超快，它能够把各种模块很轻松地联结在一起,开发人员不必重复造轮子，像搭积木一样就可以完成绝大部分工作， 非常适合初学编程者。　　　未来将是人工智能的天下，越来越多的工作都将被人工智能替代！如果你够睿智，就算是壮士断腕，也要毅然决然地走进“人工智能”，四年后，当第一期AI大学生进入这一领域时，你已经年薪百万，已经是他们的总监、是他们的CEO了。人工智能时代刚刚拉开帷幕，现在加入，你就是下一个技术时代的王者。详询电话（微信）：18910253892北京中关村软件园欢迎您！"
北京,12K-20K,【零点】Java工程师,职位描述：岗位职责 1、参与业务需求讨论，负责业务需求到技术实现的方案落地与实施；2、根据业务需求制定技术接口规范并与前端开发人员配合实现相关业务流程；3、负责现有有业务系统的维护及需求变更，参与新需求开发及缺陷修复工作。任职要求：1、本科及以上学历，计算机软件相关专业，3年以上相关工作经验；2、熟悉和理解Java开发各层次框架，如spring、Spring MVC、 hiberate、mybatis等；3、熟悉分布式应用系统的相关框架及技术，如rpc框架、配置中心、消息队列、缓存等；4、熟悉并在项目中使用过Spring Cloud框架。5、有比较好的面向对象设计和编程理念，有较好的设计功底，掌握一部分设计模式；6、在技术领域有很好的学习钻研精神，熟悉高并发、高性能的分布式系统的设计、开发、问题解决以及调优相关知识；7、积极乐观的心态，能够拥抱变化，敢于建议，勇于创新。
成都,5K-9K,Java软件开发工程师,"投递简历时请确认本公司地址后再投递，以免安排面试后拒绝参加或无故缺席！谢谢！请勿重复投递！公司地址：成都市高新区高朋大道3号东方希望A座（二环旁）正式录用后享受公司福利：1.五险一金、国家法定节假、朝九晚六双休2. 项目奖金3. 体检福利、午餐津贴等--------------------------------------------------------------------------岗位职责：1.参与应用系统开发、测试、交付过程，并按规范编写相关文档。2.根据设计完成开发，单元测试及规范的成果交付。3.参与项目组的内部培训计划。任职要求:1.英语四级水平，有熟练的读写能力和基本的听说能力。2.计算机相关专业本科及以上学历优先，1-3年相关工作经验。3.熟悉JAVA, Servlet, JNDI, JMS, JAXP and JDBC等J2EE相关技术。4.熟悉使用JavaScript, JAXP, JQuery的使用和应用开发。5.有Weblogic或Websphere等应用服务器使用经历优先。6.熟练书写SQL语句, 有Oracle相关使用经历优先。7.熟练使用eclipse和PL/SQL。8.思维活跃,具有良好的工作态度和团队合作意识,能承受较大的工作压力,有意愿从事金融行业软件的开发。9.能够适应国外出差,且善于沟通。"
天津,10K-17K,中级java开发工程师,注：非本科以上学历勿扰，3年以下经验勿扰招聘要求：（1）计算机相关专业本科及以上学历，3年以上Java开发经验；（2）熟练掌握Java、HTML/Javascript/CSS，JSP/Servlet、JDBC等JAVAEE相关技术；（3）熟练掌握Oracle，MySQL等数据库；（4）熟练掌握WebLogic、Tomcat等应用服务器；（5）精通MVC模式下的B/S开发，熟悉Struts/MyBatis/Spring/SpringMVC等开源框架；（6）敬业、责任心强，良好的沟通能力。
温州,7K-10K,java研发工程师助理,"职位描述：1、完成软件系统代码的实现，编写代码注释和开发文档；2、辅助进行系统的功能定义,程序设计；3、熟悉SSH、SSM、JFinal等开发框架；4、熟练使用mysql，sql server等常用数据库;5、熟练使用memcache、redis或其他 nosql 数据库；6、了解html、javascript、css和ajax技术，并熟练使用jquery；7、熟悉掌握Tomcat、Jetty；任职资格：1、计算机或相关专业大专学历以上，2年以上工作经验；2、具有扎实的java基础；3、有一定 web mvc 编程基础；4、熟悉区块链和相关技术优先；5、吃苦耐劳，有较强的团队协作能力；"
成都-高新区,8K-15K,JAVA高级工程师（大数据方向）,"岗位职责：1. 根据公司的产品/项目要求，承担开发任务，按计划完成任务目标，并保证交付品的质量；2. 辅助产品经理完成产品的原型设计；3. 独立完成软件系统/模块的编码；4. 协助测试人员完成软件系统/模块的测试；5. 根据公司的产品/项目文档要求编制相关的技术文档；6. 培养新人，带领中、初级工程师完成研发任务。职位要求：1. 计算机等相关专业本科及以上学历，5年以上工作经验；2. 精通Java语言及J2EE体系结构，有较好java技术基础或大型web应用开发经验；3. 熟悉Spring，SSH，SpringMVC，MyBatis等开源框架；4. 熟练掌握ORACLE数据库及SQL语言、存储过程等；5. 具有较好数据库设计经验和SQL优化功底。6. 熟悉HTML/CSS/JavaScript/jQuery等web页面开发；7. 具有使用greenplum，postgreSQL相关项目经验者优先；8. 有SaaS平台、电商平台、BI平台大数据服务开发经验者优先考虑；9. 较强的业务理解能力、有责任心，能承受工作压力；10. 快速学习能力，良好的沟通表达能力和团队合作精神。我们将把JAVA高级工程师培养为大数据高级工程师。四川数字灯塔科技有限公司官网：http://shuzidengta.cn/DataBeacon/html/home/home.html上班地址：菁蓉国际广场C1 610工作时间：9：00～18：00，周末双休工资组成：月薪（8K～15K）+年终奖（2个月工资）公司每年有年度提薪一经录用，公司自试用期起购买五险一金+提供有竞争力的薪酬+传统节日福利+员工旅游+年度体检+不定期的聚餐、各项活动+工会人文关怀+广阔的发展空间。四川数字灯塔科技有限公司成立于2016年10月，公司立足于道路交通安全行业大数据服务行业，我们的使命是用数据服务生活，我们目标是3年内成为道路交通安全行业的领头羊，公司的企业文化是诚信,积极,共赢,快乐。公司立志为包括我们的股东，员工，顾客，乃至商业合作伙伴在内的所有人提供创造和实现梦想的机会。公司目前有资深的管理团队和技术团队，成熟的客户市场，未来三年内我们的目标是营收过亿，同时初创企业也是每个人充分展现自己最好的舞台，未来的高管，股东也会出现在今天共同浴血奋战的同事中。既然选择了远方，便只顾风雨兼程，困难我们一起扛，赢了我们一起狂！不同于其他创业公司，我们有成型和现成的市场，销售渠道。公司已与3个省已经签订合同，其余2个省份，多个地市已经申请预算，明年商务会继续开拓市场。等2018年我们会和我们的每位员工分享我们的硕果！公司目标3年内成为道路交通安全行业大数据服务领军人。您获得的不仅是一份工作，一起来挑战自己吧！"
广州,10K-15K,Java开发工程师,岗位职责：1.根据系统需求，分析、设计与实现系统软硬件整体架构，保障系统架构的合理性、可扩展性及经济性；2.参与重要模块的详细设计，控制质量；负责重要技术问题的攻关，系统优化；3.制定相关技术开发规范，参与制定技术标准，编写相应的技术文档，并对通用技术进行整理，提高技术复用；4.能制定合理的开发工作计划，并有效地按照计划完成工作；5.积极了解业界发展、相关新技术及趋势。任职资格：1.计算机等相关专业大学本科及以上学历，3年以上大型互联网公司经验；2.熟悉多线程及网络编程；熟悉大容量、高并发服务器的设计及优化技术；3.精通Java语言，并熟悉至少一种其它开发语言；4.熟悉主流开源框架的使用，如SpringBoot、SpringMVC、MyBatis等；5.同时熟悉WEB前端应用框架者优先考虑；6.熟悉MySQL的使用，熟悉缓存技术，如Redis，在生产环境中使用过至少一种NoSQL产品；7.自学能力强，有责任心，上进心。
上海,15K-30K,FullStack全栈工程师（Java）,岗位职责：1.负责公司基于Web的产品技术架构以及产品总体技术方案设计2.带领研发团队对产品进行功能规划、需求分析和技术实现3.负责所属模块的代码开发、调试与维护工作4.配合项目经理完成公司网络端产品新技术的研究及开发。岗位要求：1.计算机或相关专业毕业，统招全日制本科以上学历2.精通至少一种后端编程语言(Java、C/C++、C#、Python中任一种)，熟悉至少一种常用后端框架(Node.js、Spring+Struts2+Hibernate/ibatis、Django中任一种)3.熟练使用关系型数据库（如MySQL、PostgreSQL等）和非关系型数据库（如MongoDB、Hbase、Redis等）4. 2年以上前端开发经验，精通前端基本技术，包括HTML/CSS/JavaScript/jQuery/Bootstrap等5.熟练掌握至少一种常用前端框架，如React、AngularJs、Vue.js等，参与过2个以上Web商业项目的开发6.熟练使用前端开发工具及调试工具，会使用grunt、gulp、webpack等前端工具7.熟悉部署tomcat、jboss服务器应用8.会使用git进行代码协同管理9.具备良好的文档编写能力10.有较强的独立解决问题能力、学习能力、以及沟通能力有以下经历者优先：1.有使用React/Redux或Vue.js开发商业项目经验2.在github发布或参与过其他开源项目3.在技术博客或者论坛中发表文章
大连,4K-6K,Java中级工程师,"职位描述：a) 理解业务需求与QA提出b) 编写详细设计书c) coding、单体测试中级开发工程师职位要求：a) 日语三级以上、具有高度责任心、做事细心，优秀的沟通能力和团队协作精神；b) 扎实的J2EE理论知识，掌握java模式及J2ee核心模式，使用过常见的Java开源框架（SSH、SSI等）c) 掌握Oracle开发及理论知识,掌握oracle pl/sql 存储过程开发；d)基础知识过硬、有很强的调研能力和解决问题的能力、希望在开发领域长期发展"
上海-徐汇区,10K-15K,java工程师,1、负责项目研发工作，根据产品需求完成文档设计。2、按照设计要求，完成编码工作（含测试问题修改）。3、根据项目需要完成系统联调工作。任职资格：1、 本科及以上学历；2、 3年以上JAVA开发经验，熟悉主流微服务，有系统落地实施经验者优先；3、 了解Spring Cloud、Spring Boot、redis、mq等主流框架，熟悉Mysql、nosql等数据库的应用；4、熟练使用angular6，使用angular6进行企业开发；5、 熟悉互联网IT技术开发流程，熟悉git等工具；6、 良好的沟通协调能力和有较强的学习能力，能承受一定的工作压力。
无锡,6K-10K,JAVA高级工程师,"- 拥有三年以上Java、WEB相关软件开发经验，并且参与过多个具有一定规模的软件研发及实施项目；- 精通J2EE，熟悉常用框架,譬如springMVc, spring,mybatis, 有实际开发经验；- 有基于mysql,postgresql,sqlserver数据库应用系统的开发经验；- 具有面向对象的分析和设计能力。掌握常用的设计模式,有UML的实际应用经验；- 工作积极主动,具备较强的责任感且有优秀的分析、组织及技术指导能力- 熟悉高并发、高可靠性系统的设计、监控和运维，如负载均衡系统、集群和应用监控、系统容量评估、流量控制、性能优化、故障排查、日志收集等- 有springCloud和dubbo相关开发经验优先"
天津,17K-25K,高级java开发工程师,注：非本科以上学历勿扰，4年以下经验勿扰招聘要求：（1）全日制本科及以上学历，计算机相关专业；（2）5年及以上JAVA项目和研发工作经验，精通JAVA平台主流技术；（3）深入理解Spring、MyBatis、Hibernate、Struts等框架；（4）熟悉Oracle等关系型数据库开发，并对数据库设计及优化有一定的了解；（5）主持或参与过JAVA应用中间件架构的设计和开发：包括应用基础架构、用户权限、单  点登录、工作流、表单、门户等；（6）善于学习、沟通，并具有团队管理经验；（7）有过处理高并发开发经验的优先考虑。
昆明,5.9K-11.8K,JAVA+AI软件工程师实习生,"人才基地承担着中关村软件园园区内500多家知名IT企业的人才培养、招聘的任务，本次招聘的岗位全部采用企业定制，所招实习生实习结束，统一安排在园区工作，千载难逢，机会难得......【招收岗位】：1、Java+大数据软件开发工程师签约实习生2、 人工智能+Python开发工程师签约实习生【任职要求】：1、大专及以上学历，计算机（网络)、电子信息、软件工程、（电气）自动化、测控、生仪、机电、数学或英语等专业。2、有计算机语言基础者优先，如：C语言、Java、.Net、PHP等；【福利待遇】：1、签订正式《劳动合同》、五险一金等。2、在京工作一年后要求回当地工作的，可申请调回当地省会城市的分公司或合作企业工作。【职业背景】1、Java+大数据——Java已经连续21年位居热门编程语言之首。在薪酬待遇方面，远高于其他程序员。Java+大数据开发工程师，待遇更高，入职轻松起薪12k.2、人工智能+ Python——人工智已经走进我们的生活，来得有些突然，以至于目前国内大学还没有开设人工智能专业，一名入门级的AI工程师月薪轻松就可以拿到15K，中、高级工程师，企业更是给出30万到150万的年薪；Python非常适合AI开发，它更接近自然语言，编程简单,速度超快，它能够把各种模块很轻松地联结在一起,开发人员不必重复造轮子，像搭积木一样就可以完成绝大部分工作， 非常适合初学编程者。　　　未来将是人工智能的天下，越来越多的工作都将被人工智能替代！如果你够睿智，就算是壮士断腕，也要毅然决然地走进“人工智能”，四年后，当第一期AI大学生进入这一领域时，你已经年薪百万，已经是他们的总监、是他们的CEO了。人工智能时代刚刚拉开帷幕，现在加入，你就是下一个技术时代的王者。详询电话（微信）：18910253892北京中关村软件园欢迎您！"
济南,10K-20K,JAVA工程师（中级）,岗位职责：1、根据设计文档或需求说明完成代码编写，调试，测试和维护。2、完成软件系统代码的实现，编写代码注释和编写设计等开发文档。3、分析并解决软件开发过程中的问题；4、配合项目经理完成相关任务目标。5、适应项目长期出差任职要求：1.本科及以上学历，3年以上java开发工作经验，Java基础扎实，熟练掌握JavaWeb编程。2.熟悉主流框架，包括Struts2、SpringMVC、Springboot、hibernate/ibatis等；3.熟悉Web前端技术，包括Vue、ExtJs/HTML/XML/CSS/JavaScript/Ajax/JQuery等；4.熟悉主流数据库，包括Oracle/SQLServer/Mysql等；5.熟悉互联网开发模式，清晰理解MVC模式
