地点,薪资,职位,岗位需求
杭州,6K-8K,java软件开发工程师,"岗位职责：1、负责所属模块的开发建设，包含功能的规划、需求分析设计与技术实现，并进行单元测试；2、根据需求、设计文档完成指定的设计、开发工作；3、修复系统中存在的Bug；4、完成其他交办的各类技术开发任务。岗位要求：1大专以上学历，精通Java语言。熟练oracle,有过erp系统审核流经验优先。2.熟悉Java服务器端开发，了解设计模式，熟悉springmvc、mybatis、3.熟悉javascript、CSS、HTML、jsp、jQuery、html、ajax、bootstrap前端框架与技能，熟悉TCP/IP、HTTP的基本工作原理；4.熟练应用各种开发工具如Myeclipse,idea，熟练应用各种应用服务器如tomcat；5.熟悉使用Memcached、Redis等缓存技术，有高并发编程经验或具有高校管理软件开发经验者优先；6.阅读并分析过开源框架源码；7.工作责任心强，具有一定的抗压能力，热爱自己从事的行业，有团队管理经验更佳。"
南京,15K-25K,Java Web开发,"岗位职责：1、 负责公司现有平台及产品的前端迭代开发，易用性改进、界面技术优化和网站性能优化，以及问题修复，并编写相关技术文档。2、 负责公司新建平台与产品的前端架构设计及开发工作，并编写相关技术文档。3、 配合后台开发工程师进行接口调试，功能端到端联调。4、 配合架构师进行模块需求分析、设计、开发，配合测试人员进行测试。5、 需要完成部门领导安排的其他工作任务。任职要求：1、计算机相关专业，全日制硕士研究生及以上学历，参与过大型项目研发，熟悉软件开发流程；2、精通JavaScript语言，熟练掌握vue、js, angular、js, node、js架构。3、精通CSS，HTML，熟悉W3C标准及规范，熟练掌握盒模型、常用布局以及浏览器和移动设备兼容性。4、熟练掌握浏览器的资源加载、渲染机制，以及网站性能优化、体验优化。5、具备良好的前端编程能力和编程习惯，对前端模块化开发有一定经验。有模块化，组件化开发经验者优先考虑。6、有互联网开发从业经验或电信业务从业经验者优先。7、具备良好的沟通能力及团队合作精神。8、年龄： 35周岁及以下；9、具备3年以上前端开发相关工作经验。"
苏州-相城区,10K-15K,中级java工程师,岗位要求:1、精通Java web应用开发，精通MVC架构设计；2、精通dubbo，spring boot/security/cloud，mybatis，hibernate，Redis，JQuery等开源框架的使用和调优；3、精通各种关系型数据库的使用运维，精通SQL语句编写和调优；4、熟练掌握Linux操作运维，熟练编写Shell/Perl/Python脚本；5、精通echarts、highcharts、D3等可视化工具的一种或多种；6、快速的学习能力、能够承受较强的工作压力；7、善于沟通、乐于合作，有强烈的责任心、工作积极主动；8、能够独立带领小项目的开发或能够独立负责大项目中的模块开发，具有一定的项目管理经验。职位责任：1、负责业务需求整理、系统设计、系统框架搭建；2、负责系统核心代码编码；3、参与电子政务平台的设计和研发；4、负责研发小组的管理；5、负责code review、技术预研和应用；6、负责内部技术培训、知识传授；有电子政务或行政审批相关业务经验优先。
南京-雨花台区,10K-15K,高级java开发工程师,1、熟练使用并深刻理解主流的技术框架，Spring、SpringMVC、mybatis等(必须有2年以上使用经验)。2、熟悉数据库设计，熟悉MySQL/ORACLE数据库，并具有较好的SQL编写及优化能力。3、熟悉Linux系统，了解大数据hadoop基本技术作用，了解前后端交互相关知识。4、思维活跃逻辑清晰，良好的沟通能力，有较强的抗压能力，有较强的自主学习能力，善于分析、归纳、快速定位并解决问题。5、有大数据相关项目经验者优先。
济南,6K-10K,JAVA开发工程师,岗位职责：1.负责公司软件项目的设计、开发、调试和维护；2.根据产品需求完成需求分析，功能设计，模块编码和单元测试；3.跟进最新技术，对产品的技术方案进行演进，改善软件的易用性，提升用户使用体验。任职要求：1.统招本科及以上学历，计算机相关专业；有一年以上软件开发工作经验；2.熟练使用Java开发技术，熟悉JavaEE 技术体系架构和设计模式；3.了解Spring、Struts、Hibernate等主流框架；掌握html、css、jquery、JavaScript、jsp编程；4.熟悉主流数据库（Oracle/Mysql）；5.具备较强的沟通能力；有良好的团队协作能力、学习和理解能力，能够较快了解和掌握新知识；具备综合分析和解决问题能力；具备优秀的文档阅读和编写能力；6.诚实、踏实、认真负责，愿意长期从事软件开发工作，能承受一定的工作压力。福利待遇：1. 享受同行业富有竞争力的薪资待遇，具有广阔的提升空间；2. 免费三餐、舒适员工公寓、免费班车；3. 缴纳五险一金，解决济南户口，托管个人档案，享受法定节假日、带薪年假等各类假期；4. 舒适的办公环境，提供健身器械、娱乐设施，满足工作之余的放松休闲；5. 享受节日礼包、健康体检、通讯补助、生日蛋糕、子女入托、活动经费等各类补贴；6. 文化活动精彩多样、奖品丰厚，专项部门活动经费，团队氛围积极向上。
济南,12K-16K,java开发工程师,"工作职责：1,参与产品方案讨论和技术实现设计，并负责相关文档的编写维护；2,独立完成代码开发，并负责解决相关问题；3,对代码持续优化改进，对技术深入研究岗位要求:【*】5年以上开发经验，且带过团队。1,熟悉Java及Web应用的开发，有良好的编码习惯;2,3年以上Java项目、互联网开发经验、系统模块设计经验;3,深入理解面向对象编程和J2EE技术;4,熟练使用mysql数据库以及相关优化；5,熟练使用SpringBoot。"
南京,10K-15K,java开发工程师,岗位职责：1、 负责公司产品后台的设计和研发工作；2、 按照产品的开发任务和进度要求，依照软件开发需求，实现模块功能；3、 按时保质编写代码，完成公司指定的各版本软件产品的开发任务；4、了解并掌握系统设计与优化，具有一定的需求分析能力和单元测试能力。岗位要求：1、 本科及以上学历，计算机相关专业优先；                            2.、三年以上Java开发经验，基础扎实，理解多线程、集合等基础框架并熟悉各种常用设计模式；3、 熟练使用html、javascript、springMVC mybatis jquery等技术进行Web开发以及应用程序开发，熟悉mysql oracle redis MQ netty 等；                   4、 有一定的抗压能力强和团队合作精神，具有强烈的责任感，出色的沟通能力和学习能力；    5、 具有良好的逻辑思维能力和较强的分析问题和解决问题的能力。
郑州,8K-10K,高薪急聘java软件工程师,java实习生/应届毕业生（1-3k）1、计算机相关专业，具有扎实的计算机基础理论知识，熟悉常用的java web开发技术3、积极向上、具备良好的沟通能力与学习能力4、在校期间获得过参与过技术赛事并获得过奖励优先5、勤奋钻研，喜欢计算机行业并愿意从事软件开发工作者优先。初级java工程师(2-4k)任职要求：1 ，计算机相关专业，具有扎实的计算机基础理论知识，具备基本的JAVA项目开发经验；2，熟悉常用Java web开发技术，熟悉J2EE规范；3，熟悉基于数据库的设计和开发，能熟练使用至少一种常用关系型数据库；4，积极向上、工作认真，有良好的学习能力及团队合作能力；中级java工程师(4-8k)任职要求：1 ，计算机相关专业，具有扎实的计算机基础理论知识，三年以上JAVA项目开发经验；2，熟悉常用Java web开发技术，熟悉J2EE规范；3，熟悉基于数据库的设计和开发，能熟练使用至少一种常用关系型数据库；4，熟悉JAVA网络编程或Linux操作系统者优先；5，具有公检法相关项目开发经验者优先。6，积极向上、工作认真，有良好的学习能力及团队合作能力；java 高级软件工程师(8K-12K)岗位职责：1.全面参与公司软件产品的需求分析、系统设计与开发文档编写2.承担软件产品的编码、测试和维护工作3.配合项目经理完成新产品的开发和维护任职要求：1.五年以上JAVA项目开发经验；2.精通Java编程语言，精通常见WEB开发框架；熟悉JSP、SERVLET、JDBC、XML等常用的编程技术，熟悉JAVA网络编程和多线程；3.精通标准SQL语言，并熟悉使用一种关系型数据库（Oracle、MySql、SqlServer等）；4.掌握Javascript、HTML、CSS、Ajax、jQuery、easyui等前端开发技术。5.熟悉TOMCAT、JBOSS、WEBSPHERE、WEBLOGIC等常见中间件6.熟悉web services技术，熟悉各类开源项目；7.具有公检法相关产品开发经验者优先。8.具备勤奋钻研的精神，良好的学习能力及团队合作能力。
北京-朝阳区,20K-25K,java开发工程师,岗位职责：1、根据业务需求与前端组协作开发并实现各产品功能；2、参与后端研发中涉及到的技术框架选型及相关实现；3、与数据组协作完成核心接口的定义、使用、测试并保证业务代码的运行效率；4、与测试组及运维组协作实现产品上线，并监控产品服务，及时处理线上异常；任职要求：1. 5年及以上Java服务器端开发经验；2. 精通J2EE相关技术，精通mybatis、spring MVC、SSH等开源主流技术框架；3. 掌握MySQL数据库的开发、配置、管理、调试，熟练掌握SQL查询优化及存储过程编写；4. 熟练使用svn、git、maven等版本管理工具5. 精通关系型数据库的使用，并了解NoSQL技术；6、熟悉分布式架构，了解一些分布式框架应用，熟悉高并发、负载均衡、消息队列；7. 熟悉各种主流开源框架及应用，喜欢挑战与钻研新的技术实现；8. 良好的沟通能力及解决问题的能力，良好的职业道德及敬业精神。
北京-海淀区,15K-25K,中高级Java开发工程师,"岗位职责：负责呱呱财经后台系统开发，涉及到：图文，问答，拜师，直播，短信平台，业务代理，cdn管理，配置后台，权限管理，讲师体系，消息系统，优惠券系统，计费，结算……等项目。任职要求：1、本科学历,专业不限,5年以上 Java 开发经验2、近两年的工作里都在使用Spring、SpringMVC、mybaits、redis、rocketmq、Dubbo+zookeeper、mysql、Maven、Nginx开发互联网相关项目3、熟悉java语言.有项目中使用分布式、缓存、消息、搜索、负载均衡等机制的经验；4 . 有一定前端能力如Prototype，Jquery是加分项5、具备良好的分析解决问题能力，非常良好的编程及测试习惯(加分项)，工作积极主动."
北京,15K-20K,java开发工程师,本科或以上学历，计算机相关专业，有三年以上JAVA开发经验。具有良好的Java基础知识，熟悉Java常用数据结构。熟悉主流开源框架，如：Spring、Spring Boot、SpringMVC、Spring Cloud、Mybatis/Hibernate。熟悉分布式系统的机制和应用，如：Redis、Zookeeper等。至少熟悉一种消息队列，如：RabbitMQ 或者 ActiveMQ。精通 MySQL 应用开发，熟悉数据库原理和常用性能优化技术。了解常用NoSQL的原理、使用场景以及限制，如：MongoDB。良好的沟通能力及团队合作精神，责任心强。熟悉规范化的软件开发过程，熟悉单元测试相关技术。有工作流开发经验者优先。有ERP经验者优先。有互联网研发经验，架构经验者优先。
太原,3K-6K,java软件工程师,"计算机或相关学科·2年以上JAVA开发经验·能够完成开发项目的需求分析，数据库设计，详细设计·拥有开发多层架构的产品经验·JAVA服务器端开发经验: JSP, JavaEE, SSH·熟悉客户端脚本： HTML, Javascript, AJAX, CSS·熟悉后台数据库的构造、调用、以及数据查询的性能优化·良好的学习能力, 思维敏捷, 喜欢钻研, 工作勤奋主动, 善于合作，高度的敬业精神和团队合作意识。工作时间：周一至周五，每日7小时。早9：00-12:00，下午2:30-6:30。"
北京,10K-18K,Java开发工程师（支付方向）,岗位职责：1、负责本公司互联网金融产品的需求分析与产品规划；2、负责本公司交易收单、核心清算、运营支撑、账务会计等系统的优化与升级；3、负责本公司的软件产品设计、开发和项目管理；4、负责与客户和银行沟通、协调。任职要求：1、大学本科及以上学历，计算机、信息系统、电子商务等相关专业；2、2年以上商业软件开发和管理经验；3、精通Java语言，精通Spring等开源框架，有系统架构工作经验；4、熟悉Oracle数据库服务器，熟悉Unix/Linux操作系统；5、良好的沟通能力和团队合作精神；6、具有金融行业、支付行业从业经历者优先。7、加分项：zookeeper、redis、kafka等。
西安-高新技术产业开发区,8K-10K,java中级工程师,岗位职责：1，参与项目的需求分析，完成相关的技术文档2，负责项目中业务功能接口和基础类库的设计，解决项目中的关键问题和技术难题，确保产品的质量和安全；3，根据技术文档独立完成编码5，维护公司现有项目的正常运行任职要求1，计算机相关专业毕业，3年以上实际工作经验2，掌握java web开发相关知识3，掌握spring，spring mvc，mybatis，hibernate，spring data jpa，spring boot等开源框架4，熟悉mysql，oracle等关系数据库，有调优经验者优先5，熟悉redis nosql数据库6，熟悉前端技术，有较为扎实的javascript基础知识，熟悉JQuery等前端框架，能熟练接入前端插件7，熟悉freemarker等前端模板8，熟悉项目部署，熟悉tomcat和nginx等9，能熟练使用maven，有maven构建经验加分项1，分布式开发经验2，有高校项目开发经验优先
上海,薪资面议,信息技术部-JAVA系统开发岗,岗位职责：1. 根据公司业务需要，负责公司项目的开发。负责对现有系统的升级优化，二次开发变更；2. 协助系统架构岗完成界面交互、应用架构、集成架构等专项架构设计和落地执行；3. 协助系统架构岗完成系统功能模块设计；4. 协助项目经理确定项目开发周期及人员安排；5. 协助监控项目开发质量和成本控制；6. 当开发工作外包时，对外包项目进行项目管理，确保项目质量；7. 协助需求调研与分析、系统测试、最终用户培训、系统推广等工作；8. 完成功能模块的代码编写，单元测试，维护升级，代码入库；9. 完成相关技术文档的编写和管理；10. 协同部门其他成员完成服务器端的环境搭建和整体优化；11. 根据应用系统需要，提出对基础设施的使用需求。任职要求：1. 大学本科及以上学历，计算机、数学物理、信息管理等专业优先；2. 三年以上信息技术从业经验，两年以上java开发经验；3. 信息技术相关证书；4. 熟悉相关开发技术（JAVA等）。熟悉各项中间件（Tomcat/Weblogic/Apache等）。5. 良好的职业道德素质、较强的沟通协调能力、正直诚信。对常用数据库有一定了解。
长沙-开福区,4K-6K, JAVA程序开发助理+双休,"岗位职责：1、完成软件系统代码的实现，编写代码注释和开发文档；2、辅助进行系统的功能定义,程序设计；3、根据设计文档或需求说明完成代码编写，调试，测试和维护；4、分析并解决软件开发过程中的问题；5、协助测试工程师制定测试计划，定位发现的问题；6、配合项目经理完成相关任务目标。任职资格：1、喜欢计算机相关行业。2、有责任感，团队意识强，有较好的学习能力者；3、能熟练运用计算机基本操作；4、渴望能有一项扎实的技术，一份稳定的工作的有志青年；公司福利：1、薪酬福利：为员工提供富有竞争力的薪酬体系并每年对员工进行年度薪酬调整。2、社会保险：五险一金3、晋升机制：公司设立良好的晋升机制并提供内部招聘、职位轮换机会。4、成长与职业发展：人力资源部为所有岗位建立了成长模式和职业发展通道，并以顾问形式为员工提供成长建议。5、节日贺礼：公司在传统佳节派发节日礼品以增添节日气氛。6、生日派对：员工过生日公司生日派对及贺卡以表祝福7、公司给予员工生活关怀，公司设有茶水间，员工休息室，提供微波炉，冰箱等。面试地址：长沙开福区芙蓉中路一段458号平安大厦7楼人事部周一至周五9：00-17:00均可面试工作时间：早上9:00到晚上17:00，周末双休"
长春,4K-8K,java开发工程师（职业教育事业部）,岗位职责：1、负责JAVA新项目功能开发；2、负责项目的维护和升级；3、负责解决开发过程中的技术问题；4、负责配合编写开发文档工作；5、统一代码风格、落实测试、确保代码质量；任职要求：1、本科以上学历，计算机相关专业；2、二年以上实际JAVA软件项目开发工作经验，二年以上web开发经验优先；3、至少熟悉JAVA，SpringMVC；4、至少熟悉一种数据库技术如Oracle/SQLServer/Mysql等，能熟练进行软件界面开发以及维护升级；5、具备良好的文档编制习惯和代码书写规范；6、思路清晰，善于思考、责任心强，工作踏实，肯于学习，具有良好的团队精神和沟通能力。
天津,10K-20K,JAVA架构/高级Java,岗位职责：1、负责项目需求调研、分析、确认工作；2、规划项目研发和实施进度安排，并落实进度计划执行；3、全面监控项目开发质量、进度和成本控制；4、负责与乙方开发人员进行沟通，项目质量监督，保证项目正常有序的进行；5、负责项目团队工作分配、人员培训和绩效考核；6、负责核心功能模块的开发与架构；岗位要求：1、 熟悉JAVA软件开发的流程和项目实施经验，有大中型项目的开发和实施经验，能够胜任项目管理工作，5年以上JAVA开发经验，2、熟悉项目管理、软件研发过程管理，具有较强的需求分析和设计能力；3、数练使用ssm、ssh等主流框架及各种web开发工具；熟练掌握mysql等数据库; 熟练使用tomcat使用及集群安装；4、对架构设计有深刻的理解，处理过高性能，高并发的网站优化5、电商项目及各种后端管理平台经验优先；6、良好的敬业精神及团队合作精神；7、良好的沟通协调能力和责任心；
济南,6K-8K,Java中级工程师,"岗位职责 1.按照设计和规范进行软件编码工作；2.应用Java等相关技术路线实现业务逻辑的开发和实现；3.应用互联网典型技术，对系统进行改善优化；4.负责客户需求的实现和问题解决；5.完成上级安排的其他工作。任职要求1.计算机相关专业，正规院校大专（含）以上学历；2.2年以上专业从业经历；具备一定的独立开发能力，能够胜任开发组织中的一个或多个角色；3.精通JavaScript,有使用Jquery等js框架的经验；4.有使用vue框架的前端经验者优先；5.精通Java体系；6.熟练使用MySql、Oracle 等关系型数据库，熟悉SQL语句。"
北京,10K-15K,java高级工程师,此职位工作需要3年以上实际开发经验，请应届及3年实际开发经验以下者请勿投，谢谢合作，避免浪费双方时间1. 具有扎实的Java基础，逻辑思维缜密；2. 2-3年WEB开发经验3. 熟练使用Spring+SpringMVC+MyBatis框架；4. 熟练掌握JSON数据格式；5. 熟练使用MySql、Redis等数据库；6. 熟练使用关联查询、子查询、聚合函数等SQL语法；7. 熟练使用JSP、FreeMarker、Thymeleaf等模板之一，熟悉HTML5标签的使用；8.熟练掌握js、jQuery框架、easyUI或Ext.js框架；9. 熟悉OA、供应链技术者优先。
烟台,8K-10K,java工程师,"要求：1.3年左右Java开发工作经验2.有大数据处理经验，熟悉爬虫3.有丰富websoket爬取数据经验,了解爬虫框架。4.对数据高频率变化的处理有经验。5.对反爬虫处理有丰富的经验。"
青岛,10K-15K,JAVA高级工程师,"职位描述：1. 负责Web、移动端的后台架构开发工作；2. 负责系统架构设计，承担核心基础模块、业务功能实现、程序设计、数据库设计和编码实现；3. 参与需求调研、需求分析、软件设计，撰写产品概要设计、详细设计、接口设计等相关文档；4. 负责高并发、海量数据等方面的架构设计和性能调优。5. 在主导系统架构设计、承担系统和项目开发工作的同时，能够指导其他工程师，解决技术难题、进行技术分享，共同促进团队成员进步。6. 负责项目的整体把控（人员安排、进度汇报）。任职要求：1. 5年以上实际项目开发经验。2. 具备扎实的Java编程基础，设计模式，有良好的编码习惯；3. 熟练掌握 MySQL 应用开发、数据库原理和常用性能优化和扩展技术，以及 NoSQL，Queue 的原理、使用场景以及限制4.精通以下一种技术4-1)精通Java EE的主流开源框架，并了解其原理和机制，如Spring、iBatis、Struts等；4-2)精通C#.Net开发，有实际项目开发经验；5. 熟悉各种通讯（http，json，socket等）协议，熟练掌握各种通讯协议的开发技巧；6. 具有出色的抽象设计能力，思路清晰，善于思考，能独立分析和解决问题；7. 具备强烈的进取心和责任感, 极强的学习能力及良好的团队合作精神。8. 有大数据、分布式系统开发设计经验优先；9. 有丰富Java编程、设计经验，具有多线程、分布式、高并发、高负载、高可用性、系统调优经验者优先。"
郑州,8K-15K,java工程师,职位信息1、4年以上的大型Web应用开发及架构经验，Java基础扎实；2.熟练使用Spring、SpringMVC、Mybatis，熟悉SpringBoot、Shiro、Redis等开源框架并有实际开发经验；3.熟练掌握Weblogic/Websphere/Resin/Tomcat等一种或以上的应用服务器安装、部署、调优；4.熟练使用MySQL，PostgreSQL等数据库应用，以及分布式部署，熟悉数据库底层技术，SQL调优等；5.熟练使用Eclipse、MyEclipse等开发工具6.熟悉Tomcat开发调试和部署技术，了解常见应用服务器技术及调优方法，熟悉Tomcat集群及分布式；7.熟悉Linux下的J2EE项目开发与部署；8.熟练使用原生JS和JQuery，熟悉HTML、CSS，熟悉anglarjs、vue、Bootstrap等前端框架； 并有相关的开发经验；9.具有较好的沟通能力、团队协作能力及技术文档编写能力，具备良好的代码书写习惯，具备良好的技术跟踪和创新能力。10.熟练使用svn，git等版本控制工具，对版本控制有较深理解。任职要求：计算机相关专业大学专科及以上学历，4年以上Java开发工作经验；
沈阳,4K-8K,java开发工程师(双休+五险),职位描述：1、根据项目计划，完成个人目标。2、根据设计文档进行编码、代码注释、单元测试及完成其他开发文档。3、分析并解决编码、单元测试过程中的问题。4、及时发现设计中的问题，提出合理建议。5、协助PL完善设计及各项测试工作。6、配合项目经理完成相关任务目标。职位要求：1、计算机或相关专业，大专以上学历，三年及以上java开发设计经验。2、熟悉Java、JavaScript、JSP编程等开发语言的一种或者多种。3、熟练掌握Eclipse或同类的开发工具。4、熟悉tomcat、websphere、weblogic等应用服务器的操作。5、熟悉Oracle、SQL Server 、MySQL等数据库，熟练使用SQL语句。6、具有高度的责任心、良好的沟通能力及团队合作精神。7、精通日语。
